documentId,paragraphText,sorted_compounds
US20140128390A1,"Into a scintillation vial were placed 6-(4-fluorophenyl)-4-[(3R)-3-methylpiperazin-1-yl]-7H-pyrrolo[2,3-d]pyrimidine (5) (80 mg, 0.26 mmol), 1-[(1S)-1-isocyanatoethyl]-3-methoxy-benzene (70 mg, 0.4 mmol) and DMF (3 mL). N,N-diisopropylethylamine (0.1 ml, 0.58 mmol) was added and the reaction was stirred at room temperature for 5 hours. The mixture was placed on silica and purified with silica gel chromatography eluting with a gradient of ethyl acetate:hexanes (40-100%). 1HNMR and MS were consistent with the structure of the desired product. MS (ESI) [M+H+]+=489.55 [M−H]−=487.1.","6-(4-fluorophenyl)-4-[(3R)-3-methylpiperazin-1-yl]-7H-pyrrolo[2,3-d]pyrimidine | 1-[(1S)-1-isocyanatoethyl]-3-methoxy-benzene | DMF | N,N-diisopropylethylamine | silica gel | ethyl acetate"
US20060211697A1,"To a suspension of 2-(4-bromo-2-methoxy-phenoxy)-phenol (2.500 g, 7.50 mmol) and Cs2CO3 (3.665 g, 11.25 mmol) in acetonitrile was added dropwise methyl iodide (0.93 mL, 15.00 mmol) via syringe. After being stirred at room temperature for 2 days, the mixture was poured into water and extracted with DCM (30 mL×2). The combined layer was washed with water, dried over sodium sulfate, filtered and evaporated. The residue was purified by flash chromatography on silica column eluted with 15% of ethyl acetate (AcOEt) in hexane. The final product (1.925 g, 83%) is a white solid. M.P.: 58-60° C.",2-(4-bromo-2-methoxy-phenoxy)-phenol | Cs2CO3 | acetonitrile | methyl iodide | water | DCM | water | sodium sulfate | silica | ethyl acetate | hexane
US06613804B2,"N-(4-bromo-3-methyl-5-isoxazolyl)-2-(3,4,5-trimethoxybenzyl)-benzo[b]thiophene-3-sulfonamide was prepared in the same manner as described in Example 41. Reaction of 4-bromo-3-methyl-5-aminoisoxazole (0.55 mmoles, 97 mg), NaH (1.4 mmoles, 55 mg), and 2-(3,4,5-trimethoxylbenzyl)-benzo[b]thiophene-3-sulfonyl chloride (0.66 mmoles, 0.27 g) in THF (2 ml) yielded, after flash chromatography using 50% ethyl acetate/hexanes and recrystallization from chloroform and hexanes, 94 mg of a tan solid, m.p. 154-156° C.","N-(4-bromo-3-methyl-5-isoxazolyl)-2-(3,4,5-trimethoxybenzyl)-benzo[b]thiophene-3-sulfonamide | 4-bromo-3-methyl-5-aminoisoxazole | NaH | 2-(3,4,5-trimethoxylbenzyl)-benzo[b]thiophene-3-sulfonyl chloride | THF | ethyl acetate/hexanes | hexanes | chloroform | tan solid"
US20110136764A1,"A mixture of 3-amino-6-bromopyridine-2-carboxylic acid ethyl ester-(Compound 232G, 0.31 g, 1.3 mmol), 1,4-dioxaspiro[4,5]dec-7-ene-8-boronic acid pinacol ester (0.406 g, 1.52 mmol) and [1,1′-Bis(diphenylphosphino)ferrocene]dichloropalladium(11), complex with dichloromethane (1:1) (0.10 g, 0.12 mmol) in a 35 mL sealable microwave tube was taken up in 1,4-Dioxane (4.9 mL). This mixture was treated with a solution of Potassium carbonate (0.52 g, 3.8 mmol) in H2O (1 mL), flushed with nitrogen, sealed and irradiated in a microwave reactor for 30 minutes at 100° C. The mixture was poured into water and extracted twice with EtOAc. The combined organic layers were washed with brine, dried over Na2SO4 filtered and concentrated to a brown residue. This was taken up in DCM, treated with silica and concentrated. The resulting silica plug was loaded on to a sample cartridge and purified on an ISCO Combiflash system (0-50% EtOAc/Heptane) to isolate the desired product as 247 mg of an oil which crystallized upon standing. 1H NMR (400 MHz, DMSO-d6) d 1.30 (t, J=7.20 Hz, 3H), 1.77 (t, J=6.44 Hz, 2H), 2.32-2.40 (m, 2H), 2.60 (td, J=6.44, 1.52 Hz, 2H), 3.91 (s, 4H), 4.28 (q, J=7.07 Hz, 2H), 6.25 (t, J=4.04 Hz, 1H), 6.65 (s, 2H), 7.17 (d, J=8.84 Hz, 1H), 7.52 (d, J=8.84 Hz, 1H). MS(ES+): m/z=305.12 (100) [M+1]. HPLC: tR=3.50 min (ZQ3, polar—5 min).","3-amino-6-bromopyridine-2-carboxylic acid ethyl ester | Compound 232G | 1,4-dioxaspiro[4,5]dec-7-ene-8-boronic acid pinacol ester | [1,1′-Bis(diphenylphosphino)ferrocene]dichloropalladium(11) | dichloromethane | 1,4-Dioxane | Potassium carbonate | H2O | nitrogen | water | EtOAc | brine | Na2SO4 | silica | EtOAc/Heptane | desired product | oil"
US20160222004A1,"To a stirred, room temperature solution of 5-iodo-4′-methyl-biphenyl-3-carboxylic acid (2-methoxy-1-methyl-ethyl)-amide (1.0 g, 2.4 mmol)) in 3 ml anhydrous DMF were added LiCl (520 mg, 5 eq), Pd2(dba)3 (18.34 mg, 1.3% eq), DIPEA (0.8545 ml, 2 eq) and acetic anhydride (1.1636 ml, 5 eq). The reaction mixture was heated by microwave irridiation to 150° C. for 1 hour, then cooled and diluted with EtOAc. The combined organic layers were washed with water, brine, dried (Na2SO4), filtered, and concentrated in vacuo. The residue was purified by flash column chromatography on silica gel with hexanes ethyl acetate 8:1 to 2:1), giving 5-acetyl-4′-methyl-biphenyl-3-carboxylic acid (2-methoxy-1-methyl-ethyl)-amide (538 mg, 75%). MS (M+H)=326.",5-iodo-4′-methyl-biphenyl-3-carboxylic acid (2-methoxy-1-methyl-ethyl)-amide | DMF | LiCl | Pd2(dba)3 | DIPEA | acetic anhydride | EtOAc | water | brine | Na2SO4 | silica gel | hexanes ethyl acetate | 5-acetyl-4′-methyl-biphenyl-3-carboxylic acid (2-methoxy-1-methyl-ethyl)-amide
US08610345B2,"A mixed solution of 10 g of 2-bromonitrobenzene, 8.2 g of 4-methylphenylboronic acid, 25.4 g of tripotassium phosphate, 3.9 g of tetrabutylammonium bromide, 270 mg of palladium acetate and 150 ml of dimethylformamide was heated and stirred under a nitrogen gas stream at 130° C. for 3 hours. The solution was cooled to room temperature and 100 ml of water was poured into the solution, followed by extraction with 150 ml of ethyl acetate. The organic layer was washed twice with 100 ml of water, dried over magnesium sulfate and then evaporated. The concentrate was purified by silica gel column chromatography and then vacuum-dried to obtain 8.6 g of 2-(4-methylphenyl)nitrobenzene.",2-bromonitrobenzene | 4-methylphenylboronic acid | tripotassium phosphate | tetrabutylammonium bromide | palladium acetate | dimethylformamide | nitrogen | water | ethyl acetate | water | magnesium sulfate | silica gel | 2-(4-methylphenyl)nitrobenzene
US20100087424A1,"To a solution of 7-fluoro-2-methoxy-8-quinolinol (0.23 g, 1.2 mmol) in THF (10 ml) was added NBS (0.23 g, 1.3 mmol) and the solution stirred for 1.5 h, then concentrated. Chromatography over silica (20 g SPE, eluting with 1:1 dichloromethane/hexane) provided the title compound as an off-white solid (0.28 g, 86%).",7-fluoro-2-methoxy-8-quinolinol | THF | NBS | silica | title compound
US20150329524A1,"To a 500 mL round bottom flask containing the crude (S)-4-(4-bromo-2-fluorophenyl)-1-methyl-3-((1-propionylpyrrolidin-3-yl)methyl)-1H-1,2,4-triazol-5(4H)-one (2.95 g), was added bis(pinacolato)diboron (2.00 g, 7.88 mmol), potassium acetate (3.00 g, 30.6 mmol), PdCl2(dppf)-CH2Cl2 adduct (0.50 g, 0.61 mmol), and 1,4-dioxane (30 mL). A condenser was attached and the solution was stirred at 100° C. for 1 h. Analysis of an aliquot by LCMS indicated the starting material had been consumed and the desired boronic acid intermediate was present. The reaction mixture was cooled to room temperature, and the flask was charged with 7-bromo-3-methylquinoline (1.6 g, 7.2 mmol), and 2M aq potassium carbonate (15.00 mL). The reaction mixture was stirred at 100° C. for 1 h and then was cooled to room temperature. The solution was adjusted to pH=7 with the addition of 1N aq HCl. The desired product was extracted with ethyl acetate (2×200 mL). The combined organic layers were dried over sodium sulfate and approximately 1 g of Silicycle Si-thiol resin, filtered, and concentrated in vacuo. Purification of the residue by silica gel chromatography (0-10% methanol:dichloromethane) and then by reverse phase HPLC (35% acetonitrile/65% 0.3M aq ammonium formate) afforded the title compound as a white solid (2.3 g, 64% yield over two steps). MS(ES)+ m/e 474.4 [M+H]+.","(S)-4-(4-bromo-2-fluorophenyl)-1-methyl-3-((1-propionylpyrrolidin-3-yl)methyl)-1H-1,2,4-triazol-5(4H)-one | bis(pinacolato)diboron | potassium acetate | PdCl2(dppf)-CH2Cl2 | 1,4-dioxane | 7-bromo-3-methylquinoline | potassium carbonate | HCl | desired product | ethyl acetate | sodium sulfate | Si-thiol | silica gel | methanol | dichloromethane | acetonitrile | title compound"
US09409893B2,"The free base of 2-(aminomethyl)-4-(tert-butyl)-6-(6-(trifluoromethyl)pyridin-3-yl)phenol hydrochloride (Example 64), was prepared by partitioning the hydrochloride salt (560 mg, 1.55 mmol) between ethyl acetate and a saturated aqueous sodium bicarbonate solution. The organic phase was separated, dried (Na2SO4), filtered and the solvent removed under reduced pressure. The residue was redissolved in a solution of tert-butyl (2-oxopropyl)carbamate in ethanol (5 mL) and stirred for three days. Sodium borohydride (290 mg, 7.75 mmol) was added portionwise and the reaction mixture stirred at room temperature for one hour. The reaction was quenched with saturated aqueous ammonium chloride solution (1 mL) and the reaction mixture partitioned between ethyl acetate and a saturated aqueous sodium bicarbonate solution. The organic phase was separated, dried (Na2SO4), filtered and the solvent was removed under reduced pressure. The residue was purified using flash chromatography on silica eluting with a solvent gradient of 0-100% ethyl acetate in hexanes to give tert-butyl (2-((5-(tert-butyl)-2-hydroxy-3-(6-(trifluoromethyl)pyridin-3-yl)benzyl)amino)propyl)carbamate (500 mg, 67%) as a white solid. The carbamate (500 mg, 1.04 mmol) was dissolved in methylene chloride (20 mL) and trifluoroacetic acid (10 mL) added and the reaction was stirred for 16 h. The solvent was removed under reduced pressure, the residue azeotroped twice with toluene (20 mL) and then redissolved in a 1:1 mixture of methylene chloride and trifluoracetic acid (40 mL) and stirred at room temperature for four hours. The solvent was removed under reduced pressure, the residue azeotroped twice with toluene (20 mL) and the residue partitioned between ethyl acetate and saturated aqueous sodium bicarbonate solution. The organic phase was separated, dried (Na2SO4), filtered and the solvent removed under pressure. The residue was purified using flash chromatography on silica eluting with a solvent gradient of 0 to 100% of (89% methylene chloride, 10% methanol and 1% ammonium hydroxide) in methylene chloride. The purified residue was dissolved in a 1.25 M hydrochloric acid solution in ethanol, the solution stood for 10 minutes, and then the solvent removed under reduced pressure and the residue triturated with diethyl ether to give 2-(((1-aminopropan-2-yl)amino)methyl)-4-(tert-butyl)-6-(6-(trifluoromethyl)pyridin-3-yl)phenol dihydrochloride (150 mg, 32% yield) as a white solid.",2-(aminomethyl)-4-(tert-butyl)-6-(6-(trifluoromethyl)pyridin-3-yl)phenol hydrochloride | hydrochloride salt | ethyl acetate | sodium bicarbonate | Na2SO4 | tert-butyl (2-oxopropyl)carbamate | ethanol | Sodium borohydride | ammonium chloride | ethyl acetate | Na2SO4 | tert-butyl (2-((5-(tert-butyl)-2-hydroxy-3-(6-(trifluoromethyl)pyridin-3-yl)benzyl)amino)propyl)carbamate
US08987473B2,"To an aqueous solution (2 mL) of zinc powder (1.2 g) was added mercury chloride (124 mg) at room temperature, and then the reaction mixture was stirred at room temperature for 30 minutes. To the reaction mixture were added the compound [59] obtained in Example 59 (73 mg), toluene (1 mL), water (1 mL) and concentrated hydrochloric acid (1 mL) at room temperature, and then the reaction mixture was heated at reflux for 4 hours. After cooling to room temperature, the reaction mixture was quenched with water, and extracted with chloroform. The obtained organic layer was dried over anhydrous sodium sulfate, filtered, and the filtrate was concentrated under reduced pressure. The obtained residue was purified by silica gel column chromatography to give the titled compound (35 mg) as a yellow solid.",zinc | mercury chloride | toluene | water | hydrochloric acid | water | chloroform | sodium sulfate | silica gel | titled compound
US09115169B2,"To a stirred solution of Boc-L-Trp-OH (761 mg, 2.5 mmoles), H-L-Arg-OMe dihydrochloride (718 mg, 2.75 mmoles), HOBt (1378 mg, 9 mmoles) and DIPEA (2.05 ml, 12 mmoles) in DMF (5 ml) and dichloromethane (2 ml) cooled on ice was added HBTU (1138 mg, 3 mmoles) in small portions over 10 minutes. The mixture was stirred on ice for 1 hour, 40 ml ethyl acetate was added and the organic phase washed successively with 3×40 ml saturated NaHCO3, 2×30 ml 5% citric acid, 50 ml water and 2×30 ml brine. Evaporation afforded 1.1 g of a white solid.",Boc-L-Trp-OH | H-L-Arg-OMe dihydrochloride | HOBt | DIPEA | DMF | dichloromethane | ice | HBTU | ice | ethyl acetate | NaHCO3 | citric acid | water | brine | white solid
US08980902B2,"To a suspension of 4-(4-(tert-butoxycarbonyl)piperazin-1-yl)-3-methylbenzoic acid (2.0 g, 6.24 mmol), methanamine hydrochloride (0.506 g, 7.49 mmol), N1-((ethylimino)methylene)-N3,N3-dimethylpropane-1,3-diamine hydrochloride (1.795 g, 9.36 mmol), and 1H-benzo[d][1,2,3]triazol-1-ol hydrate (1.434 g, 9.36 mmol) in DMF (Volume: 8.5 mL) was added 4-methylmorpholine (3.43 mL, 31.2 mmol) at 23° C. The reaction was stirred at 23° C. for 2 hr. The reaction mixture was diluted with water (100 mL) and the product was extracted with EtOAc (3×100 mL). The organic extracts were combined, washed with 1N HCl (50 mL), saturated NaHCO3 (50 mL), H2O (50 mL), brine (50 mL) dried over MgSO4, filtered, rinsed with EtOAc, and dried in vacuo to provide tert-butyl 4-(2-methyl-4-(methylcarbamoyl)phenyl)piperazine-1-carboxylate (1.90 g, 5.70 mmol, 91% yield) as a yellow oil. 1H NMR (400 MHz, DMSO-d6) δ ppm 1.42 (s, 9 H) 2.28 (s, 3 H) 2.75 (d, J=4.55 Hz, 3 H) 2.79-2.87 (m, 4 H) 3.42-3.52 (m, 4 H) 7.03 (d, J=8.34 Hz, 1 H) 7.62 (dd, J=8.34, 2.27 Hz, 1 H) 7.64-7.69 (m, 1 H) 8.26 (q, J=4.46 Hz, 1 H). ESI-MS: m/z 334.3 (M+H)+.","4-(4-(tert-butoxycarbonyl)piperazin-1-yl)-3-methylbenzoic acid | methanamine hydrochloride | N1-((ethylimino)methylene)-N3,N3-dimethylpropane-1,3-diamine hydrochloride | 1H-benzo[d][1,2,3]triazol-1-ol hydrate | DMF | 4-methylmorpholine | water | EtOAc | HCl | NaHCO3 | H2O | brine | MgSO4 | EtOAc | tert-butyl 4-(2-methyl-4-(methylcarbamoyl)phenyl)piperazine-1-carboxylate"
US08158810B2,"To a mixture of prop-2-enyl 3-{[3-(4-aminophenyl)-4-oxochromen-7-yloxy]methyl}benzoate, prepared as described in Example 7A, (169.5 mg, 0.397 mmol) and anhydrous pyridine (34.5 mg, 0.44 mmol) in dry methylene chloride (3 ml) at 0° C. was added methanesulfonyl chloride (68.1 mg, 0.60 mmol). The mixture was then stirred at room temperature for 21 hours, then mixed with silics gel and the solvent removed under reduced pressure. Flash chromatography of the silica gel mixture, eluting with methylene chloride/methanol (99.5/0.5) gave prop-2-enyl 3-[(3-{4-[(methylsulfonyl)amino]phenyl}-4-oxochromen-7-yloxy)methyl]benzoate as a white solid (160.9 mg). (ESI) m/z 506 (M+H)+.",prop-2-enyl 3-{[3-(4-aminophenyl)-4-oxochromen-7-yloxy]methyl}benzoate | pyridine | methylene chloride | methanesulfonyl chloride | silica gel | methylene chloride/methanol | prop-2-enyl 3-[(3-{4-[(methylsulfonyl)amino]phenyl}-4-oxochromen-7-yloxy)methyl]benzoate
US04480112,reacting N-acetoacetyl-L-aspartic anhydride with L-phenylalanine methyl ester to form N-acetoacetyl-α-L-aspartyl-L-phenylalanine.,N-acetoacetyl-L-aspartic anhydride | L-phenylalanine methyl ester | N-acetoacetyl-α-L-aspartyl-L-phenylalanine
US20160046635A1,"N2,N4,N6,N8-tetraethyl-pyrimido[5,4-d]pyrimidine-2,4,6,8-tetraamine (124) (220 mg, 0.72 mmol) was treated with 4M HCl/1,4-dioxane in 1,4-dioxane/EtOH (1/1) using procedure described for compound (29a) (245 mg, -100% y). 400 MHz 1H NMR (CDCl3, ppm): δ 9.63 (2H, s), 6.67 (2H, t, J=5.6 Hz), 3.74-3.66 (4H, m), 3.57-3.50 (4H, m), 1.41 (6H, t, J=7.3 Hz), 1.27 (6H, t, J=7.3 Hz). ESI-MS (m/z): 305 [M+H]+; melting point: 247° C. (dec.).","N2,N4,N6,N8-tetraethyl-pyrimido[5,4-d]pyrimidine-2,4,6,8-tetraamine | HCl/1,4-dioxane | 1,4-dioxane/EtOH"
US20130090323A1,"A stirred mixture of 3-bromo-5-cyanopyridine (0.38 g, 2.1 mmol), bis(pinacol-ato)diboron (0.63 g, 2.5 mmol), 1,1′-bis(diphenylphosphino)ferrocene-palladium dichloride (0.17 g, 0.21 mmol), and potassium acetate (0.61 g, 6.21 mmol) in dry 1,4-dioxane (6.0 mL) was purged three times with argon and placed under vacuum three times. The mixture was heated to 90° C. and monitored with LC-MS and TLC. After 21 h, the reactions were cooled to rt then filtered through celite. The organic solvent was removed under reduced pressure, and the brownish-black residue was identified as 5-cyanopyridin-3-ylboronic acid and used without purification. 1H NMR (500 MHz, CDCl3) δ ppm 9.11 (1H, s), 8.93 (1H, br. s.), 8.33 (1H, s). Mass Spectrum (pos.) m/e: 149.1 (M+H)+.","3-bromo-5-cyanopyridine | bis(pinacol-ato)diboron | 1,1′-bis(diphenylphosphino)ferrocene-palladium dichloride | potassium acetate | 1,4-dioxane | argon"
US07683173B2,"To a stirred solution of 2-imidazolidone (5.0 g, 60 mmol) in DMF (100 mL) was added NaH (2.4 g, 60% in mineral oil, 60 mmol). The reaction was then heated to 50° C. and was allowed to stir until bubbling of H2 ceased (˜1 hour). To the mixture was added dropwise (3-bromopropoxy)-tert-butyldimethylsilane (13.5 mL, 60 mmol). The reaction mixture was allowed to stir for 3 hours at 50° C. After 3 hours, the reaction was cooled to room temperature and condensed under reduced pressure and then dissolved in DCM (250 mL) and washed with 1N HCl (500 mL), water (500 mL), NaCl (sat.) (500 mL), dried over MgSO4 and then filtered. The solvent was removed under reduced pressure. The crude material was purified via silica gel chromatography (10% MeOH/DCM) to afford the title compound in 45% yield (6.9 g, 26.7 mmol).",2-imidazolidone | DMF | NaH | H2 | (3-bromopropoxy)-tert-butyldimethylsilane | DCM | HCl | water | NaCl | MgSO4 | crude material | silica gel | MeOH/DCM | title compound
US05403816,"A DMF suspension (50 ml) of 3.0 g (17.8 mmol) of methyl 6-amino-3-hydroxypicolinate, 3.9 g (17.8 mmol) of 2-methylsulfonyl-4,6-dimethoxypyrimidine and 1.23 g (8.9 mmol) of potassium carbonate in a 100 ml round bottomed flask, was stirred at 80° C. for 4 hours. The reaction mixture was poured into ice water and extracted with dichloromethane. The organic layer was washed with water, dried, concentrated and purified by silica gel chromatography (n-hexane/AcOEt=1/1+0.1 MeOH) to obtain 4.43 g (yield: 81.3%) of the desired product.","DMF | methyl 6-amino-3-hydroxypicolinate | 2-methylsulfonyl-4,6-dimethoxypyrimidine | potassium carbonate | ice water | water | dichloromethane | silica gel | n-hexane/AcOEt | MeOH | desired product"
US04617394,"A mixture of 8-amino-2,6-dimethoxy-4-methyl-5-(3-trifluoromethylphenoxy)quinoline (8.0 g, 21.2 mmol), diisopropylamine (2.14 g, 21.2 mmol) and 4-iodo-1-phthalimidopentane (IPP) (7.26 g, 21.2 mmol) in CH3CN (40 mL) was refluxed for 24 hours after which time additional diisopropylamine (2.14 g, 21.2 mmol) and IPP (7.26 g, 21.2 mmol) were added. After refluxing a further 24 hours, more diisopropylamine (1.07 g, 10.6 mmol) and IPP (3.63 g, 10.6 mmol) were added and refluxing was continued a further 24 hours. The cooled mixture was diluted with H2O (20 mL) and stirred in an ice bath until crystallization was complete. Filtration and recrystallization from IPA gave 8.4 g (67%) of 1st crop title compound, mp 120°-124° C. Further recrystallization raised the mp to 121°-124° C.","8-amino-2,6-dimethoxy-4-methyl-5-(3-trifluoromethylphenoxy)quinoline | diisopropylamine | 4-iodo-1-phthalimidopentane | IPP | CH3CN | diisopropylamine | IPP | diisopropylamine | H2O | ice | IPA | title compound"
US07902375B2,The titled compound is prepared via an analogous method to 5-(3-fluoro-4-methanesulfonyl-phenyl)-4-methyl-thiazol-2-ylamine (Intermediate AA) by replacing 1-(3-fluoro-4-methanesulfonyl-phenyl)-propan-2-one (AA3) in step AA4 with 1-(4-fluoro-3-methanesulfonyl-phenyl)-propan-2-one (AG3).,titled compound | 5-(3-fluoro-4-methanesulfonyl-phenyl)-4-methyl-thiazol-2-ylamine | 1-(3-fluoro-4-methanesulfonyl-phenyl)-propan-2-one | 1-(4-fluoro-3-methanesulfonyl-phenyl)-propan-2-one
US07173035B2,"MeI (45 μL, 0.72 mmol) was added to a mixture of N-{4-(4-t-butyloxycarbonyl-1,4-diazepan-1-yl)-2-[(methylsulfonyl)amino]phenyl}benzenesulfonamide (0.189 g, 0.36 mmol) and K2CO3 (0.124, 0.90 mmol) in acetone (25 mL). The mixture was stirred at r.t. for 2 h, filtered and the solvent was removed. Purification by column chromatography (DCM/MeOH/Heptane 4:1:15) gave 110 mg of N-{4-(4-t-butyloxycarbonyl1,4-diazepan-1-yl)-2-[methyl (methylsulfonyl)amino]phenyl}benzenesulfonamide and 20 mg of N-{4-(4-t-butyloxycarbonyl 1,4-diazepan-1-yl)-2-[(methylsulfonyl)amino]phenyl}-N-methyl benzenesulfonamide. Boc-deprotection was carried out by dissolving the compounds in small amount of MeOH and adding HCl/ether. The solvent was removed and the products were recrystrallized from MeOH/ether. N-{4-(1,4-diazepan-1-yl)-2-[(methylsulfonyl)amino]-phenyl}-N-methylbenzenesulfonamide hydrochloride M+1 439.2 Calcd 439.14.","MeI | N-{4-(4-t-butyloxycarbonyl-1,4-diazepan-1-yl)-2-[(methylsulfonyl)amino]phenyl}benzenesulfonamide | K2CO3 | acetone | DCM/MeOH/Heptane | N-{4-(4-t-butyloxycarbonyl1,4-diazepan-1-yl)-2-[methyl (methylsulfonyl)amino]phenyl}benzenesulfonamide | N-{4-(4-t-butyloxycarbonyl 1,4-diazepan-1-yl)-2-[(methylsulfonyl)amino]phenyl}-N-methyl benzenesulfonamide"
US07718648B2,"Tert-butyl({6-chloro-4-[4-chloro-2-(2,6-difluorobenzoyl)phenyl]pyridin-3-yl}-methyl)carbamate (165.0 mg, 0.3345 mmol) was dissolved in methylene chloride (5 mL). Trifluoroacetic acid (5 mL, 0.06 mol) was added and the reaction was stirred at room temperature under an atmosphere of nitrogen overnight. Water (20 mL) and methylene chloride (15 mL) were added and the resulting mixture was stirred while solid sodium carbonate (4.50 g, 0.04 mol) was slowly added with stirring. The resulting basic mixture was stirred at room temperature for 30 minutes and then transferred to a separatory funnel. The organic layer was separated and the aqueous phase was extracted with additional methylene chloride (10 mL). The organic extracts were combined, washed with water (10 mL) and brine (10 mL). The organic phase was dried over sodium sulfate, filtered and concentrated in vacuo. The resulting white solid was purified by column chromatography on silica gel (elution gradient from dichloromethane to 7.5% ethyl acetate/dichloromethane) to yield 2,9-dichloro-7-(2,6-difluorophenyl)-5H-pyrido[3,4-d][2]-benzazepine (108 mg, 86%) as a white solid. The product structure was confirmed by NMR and MS.","Tert-butyl({6-chloro-4-[4-chloro-2-(2,6-difluorobenzoyl)phenyl]pyridin-3-yl}-methyl)carbamate | methylene chloride | Trifluoroacetic acid | nitrogen | Water | methylene chloride | sodium carbonate | methylene chloride | water | brine | sodium sulfate | silica gel | dichloromethane | ethyl acetate/dichloromethane | 2,9-dichloro-7-(2,6-difluorophenyl)-5H-pyrido[3,4-d][2]-benzazepine"
US20050143401A1,"2-Bromothiazole-4-carbaldehyde (6.56 g, 34.17 mmol) [A. T. Ung, S. G. Pyne/Tetrahedron: Asymmetry 9 (1998) 1395-1407] and ethylene glycol (5.72 ml, 102.5 mmol) were heated under reflux in toluene (50 ml), with a Dean and Stark trap fitted, for 18 hr. The product was concentrated and purified by column chromatography (15% ethyl acetate /hexane) to give the product as a yellow solid (6.03 g); m/z 236, 238.",2-Bromothiazole-4-carbaldehyde | ethylene glycol | toluene | product
US08124604B2,"3,5-Dibromo-1-methyl-1H-pyridin-2-one (469 mg, 1.76 mmol), 1-Methyl-1H-pyrazol-3-ylamine (205 mg, 2.11 mmol), tris(dibenzylidineacetone)dipalladium(0) (80 mg, 0.087 mmol), 2,2′-bis(diphenyl phosphino-1,1′-binaphthalene (82 mg, 0.13 mmol), and cesium carbonate (801 mg, 2.46 mmol) were deposited in a sealed vial with 10 mL toluene. This was heated at 130° C. for 18 hours. The resulting mixture was poured into 50 mL water. This was extracted with ethylacetate. The ethylacetate layer was washed with brine, dried over anhydrous magnesium sulfate, filtered, concentrated in vacuo, and purified by flash chromatography (eluted with ethylacete/hexanes) to yield 5-Bromo-1-methyl-3-(1-methyl-1H-pyrazol-3-ylamino)-1H-pyridin-2-one (271 mg, 0.957 mmol). MS (EST) 284.9 (M+H)+.","3,5-Dibromo-1-methyl-1H-pyridin-2-one | 1-Methyl-1H-pyrazol-3-ylamine | tris(dibenzylidineacetone)dipalladium(0) | diphenyl phosphino-1,1′-binaphthalene | cesium carbonate | toluene | water | ethylacetate | ethylacetate | brine | magnesium sulfate | hexanes | 5-Bromo-1-methyl-3-(1-methyl-1H-pyrazol-3-ylamino)-1H-pyridin-2-one"
US04304728,"A solution of ethyl 6-(4-chlorophenyl)-2,4,6-trioxohexanoate (0.26 g) in cold concentrated sulphuric acid (3 ml) was stirred for 3 hours at 0°-5° C. then poured on to ice (10 g). The solid product was recrystallised from ethanol-water to give the title product identical (mp, IR and NMR, and thin-layer chromatography) with the product described in Example 12.","ethyl 6-(4-chlorophenyl)-2,4,6-trioxohexanoate | sulphuric acid | ice | ethanol-water | title product"
